{
  "version": 1,
  "taskId": "12345678-1234-1234-1234-123456789abc",
  "asOfSeq": 10,
  "revision": 2,
  "state": "PURGED",
  "todos": null,
  "counts": {
    "pending": 0,
    "inProgress": 1,
    "completed": 1
  },
  "source": {
    "invocationId": "12345678-1234-1234-1234-123456789abc",
    "checkpointId": "12345678-1234-1234-1234-123456789abc",
    "providerCallId": "call-1",
    "createdAttemptId": "12345678-1234-1234-1234-123456789abc",
    "committedAttemptId": "12345678-1234-1234-1234-123456789abc",
    "fence": 2,
    "eventId": "12345678-1234-1234-1234-123456789abc:8",
    "outputSha256": "aaaaaaaaaaaaaaaaaaaaaaaaaaaaaaaaaaaaaaaaaaaaaaaaaaaaaaaaaaaaaaaa",
    "updatedAt": "2026-10-22T15:00:00Z"
  },
  "retainUntil": "2026-10-29T14:59:00Z"
}
